{
  "id": "ekenaset-fauteuil-kilanda-lichtbeige-90533174",
  "version": 1,
  "status": "draft",
  "units": "cm",
  "product": {
    "name": "EKENÄSET Fauteuil - Kilanda lichtbeige",
    "typeName": "Fauteuil",
    "article": "AA-2332891-1",
    "dims": {
      "unit": "cm",
      "text": null
    },
    "url": "https://www.ikea.com/nl/nl/p/ekenaset-fauteuil-kilanda-lichtbeige-90533174/",
    "pdfUrl": "https://www.ikea.com/nl/nl/assembly_instructions/ekenaset-fauteuil-kilanda-lichtbeige__AA-2332891-1-2.pdf",
    "image": "https://www.ikea.com/nl/nl/images/products/ekenaset-fauteuil-kilanda-lichtbeige__1109687_pe870153_s5.jpg",
    "reviews": 107,
    "rating": 4.5,
    "copyrightYear": "2022"
  },
  "manual": {
    "dir": "manual",
    "dpi": 150,
    "pages": [
      {
        "page": 1,
        "file": "p01.webp",
        "w": 1241,
        "h": 1754,
        "kind": "cover"
      },
      {
        "page": 2,
        "file": "p02.webp",
        "w": 1241,
        "h": 1754,
        "kind": "illustration"
      },
      {
        "page": 3,
        "file": "p03.webp",
        "w": 1241,
        "h": 1754,
        "kind": "illustration"
      },
      {
        "page": 4,
        "file": "p04.webp",
        "w": 1241,
        "h": 1754,
        "kind": "illustration"
      },
      {
        "page": 5,
        "file": "p05.webp",
        "w": 1241,
        "h": 1754,
        "kind": "illustration"
      },
      {
        "page": 6,
        "file": "p06.webp",
        "w": 1241,
        "h": 1754,
        "kind": "illustration"
      },
      {
        "page": 7,
        "file": "p07.webp",
        "w": 1241,
        "h": 1754,
        "kind": "illustration"
      },
      {
        "page": 8,
        "file": "p08.webp",
        "w": 1241,
        "h": 1754,
        "kind": "illustration"
      },
      {
        "page": 9,
        "file": "p09.webp",
        "w": 1241,
        "h": 1754,
        "kind": "illustration"
      },
      {
        "page": 10,
        "file": "p10.webp",
        "w": 1241,
        "h": 1754,
        "kind": "illustration"
      },
      {
        "page": 11,
        "file": "p11.webp",
        "w": 1241,
        "h": 1754,
        "kind": "illustration"
      },
      {
        "page": 12,
        "file": "p12.webp",
        "w": 1241,
        "h": 1754,
        "kind": "backmatter"
      }
    ],
    "buildPages": [
      2,
      3,
      4,
      5,
      6,
      7,
      8,
      9,
      10,
      11
    ]
  },
  "parts": [],
  "hardware": [],
  "steps": [
    {
      "title": "Page 2",
      "page": 2,
      "box": [
        0.0455,
        0.0322,
        0.9495,
        0.2509
      ],
      "duration": 4,
      "cam": {
        "target": [
          0.0,
          2.0,
          0.0
        ],
        "yaw": -0.45,
        "pitch": 0.35,
        "dist": 9.06
      },
      "prose": "",
      "boxSource": "auto",
      "camSource": "auto"
    },
    {
      "title": "Page 3",
      "page": 3,
      "box": [
        0.103,
        0.073,
        0.192,
        0.3748
      ],
      "duration": 4,
      "cam": {
        "target": [
          0.0,
          2.0,
          0.0
        ],
        "yaw": -0.45,
        "pitch": 0.35,
        "dist": 9.06
      },
      "prose": "",
      "boxSource": "auto",
      "camSource": "auto"
    },
    {
      "title": "Page 4",
      "page": 4,
      "box": [
        0.0755,
        0.0358,
        0.7895,
        0.32
      ],
      "duration": 4,
      "cam": {
        "target": [
          0.0,
          2.0,
          0.0
        ],
        "yaw": -0.45,
        "pitch": 0.35,
        "dist": 9.06
      },
      "prose": "",
      "boxSource": "auto",
      "camSource": "auto"
    },
    {
      "title": "Page 5",
      "page": 5,
      "box": [
        0.158,
        0.0429,
        0.9245,
        0.4297
      ],
      "duration": 4,
      "cam": {
        "target": [
          0.0,
          2.0,
          0.0
        ],
        "yaw": -0.45,
        "pitch": 0.35,
        "dist": 9.06
      },
      "prose": "",
      "boxSource": "auto",
      "camSource": "auto"
    },
    {
      "title": "Page 6",
      "page": 6,
      "box": [
        0.068,
        0.0429,
        0.917,
        0.4474
      ],
      "duration": 4,
      "cam": {
        "target": [
          0.0,
          2.0,
          0.0
        ],
        "yaw": -0.45,
        "pitch": 0.35,
        "dist": 9.06
      },
      "prose": "",
      "boxSource": "auto",
      "camSource": "auto"
    },
    {
      "title": "Page 7",
      "page": 7,
      "box": [
        0.238,
        0.0429,
        0.897,
        0.4686
      ],
      "duration": 4,
      "cam": {
        "target": [
          0.0,
          2.0,
          0.0
        ],
        "yaw": -0.45,
        "pitch": 0.35,
        "dist": 9.06
      },
      "prose": "",
      "boxSource": "auto",
      "camSource": "auto"
    },
    {
      "title": "Page 8",
      "page": 8,
      "box": [
        0.048,
        0.0322,
        0.9495,
        0.9288
      ],
      "duration": 4,
      "cam": {
        "target": [
          0.0,
          2.0,
          0.0
        ],
        "yaw": -0.45,
        "pitch": 0.35,
        "dist": 9.06
      },
      "prose": "",
      "boxSource": "auto",
      "camSource": "auto"
    },
    {
      "title": "Page 9",
      "page": 9,
      "box": [
        0.0705,
        0.0358,
        0.9345,
        0.4775
      ],
      "duration": 4,
      "cam": {
        "target": [
          0.0,
          2.0,
          0.0
        ],
        "yaw": -0.45,
        "pitch": 0.35,
        "dist": 9.06
      },
      "prose": "",
      "boxSource": "auto",
      "camSource": "auto"
    },
    {
      "title": "Page 10",
      "page": 10,
      "box": [
        0.063,
        0.0358,
        0.132,
        0.3624
      ],
      "duration": 4,
      "cam": {
        "target": [
          0.0,
          2.0,
          0.0
        ],
        "yaw": -0.45,
        "pitch": 0.35,
        "dist": 9.06
      },
      "prose": "",
      "boxSource": "auto",
      "camSource": "auto"
    },
    {
      "title": "Page 11",
      "page": 11,
      "box": [
        0.1205,
        0.1915,
        0.8595,
        0.5182
      ],
      "duration": 4,
      "cam": {
        "target": [
          0.0,
          2.0,
          0.0
        ],
        "yaw": -0.45,
        "pitch": 0.35,
        "dist": 9.06
      },
      "prose": "",
      "boxSource": "auto",
      "camSource": "auto"
    }
  ],
  "tags": [],
  "notes": ""
}