{
  "id": "millberget-bureaustoel-murum-zwart-70489394",
  "version": 1,
  "status": "draft",
  "units": "cm",
  "product": {
    "name": "MILLBERGET Bureaustoel - Murum zwart",
    "typeName": "Bureaustoel",
    "article": "AA-2269641-5",
    "dims": {
      "unit": "cm",
      "text": null
    },
    "url": "https://www.ikea.com/nl/nl/p/millberget-bureaustoel-murum-zwart-70489394/",
    "pdfUrl": "https://www.ikea.com/nl/nl/assembly_instructions/millberget-bureaustoel-murum-zwart__AA-2269641-5-2.pdf",
    "image": "https://www.ikea.com/nl/nl/images/products/millberget-bureaustoel-murum-zwart__1020142_pe831799_s5.jpg",
    "reviews": 95,
    "rating": 4.0,
    "copyrightYear": "2020"
  },
  "manual": {
    "dir": "manual",
    "dpi": 150,
    "pages": [
      {
        "page": 1,
        "file": "p01.webp",
        "w": 875,
        "h": 1241,
        "kind": "illustration"
      },
      {
        "page": 2,
        "file": "p02.webp",
        "w": 875,
        "h": 1241,
        "kind": "illustration"
      },
      {
        "page": 3,
        "file": "p03.webp",
        "w": 875,
        "h": 1241,
        "kind": "illustration"
      },
      {
        "page": 4,
        "file": "p04.webp",
        "w": 875,
        "h": 1241,
        "kind": "illustration"
      },
      {
        "page": 5,
        "file": "p05.webp",
        "w": 875,
        "h": 1241,
        "kind": "illustration"
      },
      {
        "page": 6,
        "file": "p06.webp",
        "w": 875,
        "h": 1241,
        "kind": "illustration"
      },
      {
        "page": 7,
        "file": "p07.webp",
        "w": 875,
        "h": 1241,
        "kind": "mixed"
      },
      {
        "page": 8,
        "file": "p08.webp",
        "w": 875,
        "h": 1241,
        "kind": "mixed"
      },
      {
        "page": 9,
        "file": "p09.webp",
        "w": 875,
        "h": 1241,
        "kind": "mixed"
      },
      {
        "page": 10,
        "file": "p10.webp",
        "w": 875,
        "h": 1241,
        "kind": "illustration"
      },
      {
        "page": 11,
        "file": "p11.webp",
        "w": 875,
        "h": 1241,
        "kind": "illustration"
      },
      {
        "page": 12,
        "file": "p12.webp",
        "w": 875,
        "h": 1241,
        "kind": "illustration"
      },
      {
        "page": 13,
        "file": "p13.webp",
        "w": 875,
        "h": 1241,
        "kind": "illustration"
      },
      {
        "page": 14,
        "file": "p14.webp",
        "w": 875,
        "h": 1241,
        "kind": "illustration"
      },
      {
        "page": 15,
        "file": "p15.webp",
        "w": 875,
        "h": 1241,
        "kind": "illustration"
      },
      {
        "page": 16,
        "file": "p16.webp",
        "w": 875,
        "h": 1241,
        "kind": "illustration"
      }
    ],
    "buildPages": [
      1,
      2,
      3,
      4,
      5,
      6,
      10,
      11,
      12,
      13,
      14,
      15,
      16,
      7,
      8,
      9
    ]
  },
  "parts": [],
  "hardware": [],
  "steps": [
    {
      "title": "Page 1",
      "page": 1,
      "box": [
        0.123,
        0.2226,
        0.9245,
        0.9644
      ],
      "duration": 4,
      "cam": {
        "target": [
          0.0,
          2.0,
          0.0
        ],
        "yaw": -0.45,
        "pitch": 0.35,
        "dist": 9.06
      },
      "prose": "",
      "boxSource": "auto",
      "camSource": "auto"
    },
    {
      "title": "Page 2",
      "page": 2,
      "box": [
        0.078,
        0.048,
        0.9295,
        0.2554
      ],
      "duration": 4,
      "cam": {
        "target": [
          0.0,
          2.0,
          0.0
        ],
        "yaw": -0.45,
        "pitch": 0.35,
        "dist": 9.06
      },
      "prose": "",
      "boxSource": "auto",
      "camSource": "auto"
    },
    {
      "title": "Page 3",
      "page": 3,
      "box": [
        0.073,
        0.0462,
        0.927,
        0.8885
      ],
      "duration": 4,
      "cam": {
        "target": [
          0.0,
          2.0,
          0.0
        ],
        "yaw": -0.45,
        "pitch": 0.35,
        "dist": 9.06
      },
      "prose": "",
      "boxSource": "auto",
      "camSource": "auto"
    },
    {
      "title": "Page 4",
      "page": 4,
      "box": [
        0.0755,
        0.0656,
        0.9095,
        0.363
      ],
      "duration": 4,
      "cam": {
        "target": [
          0.0,
          2.0,
          0.0
        ],
        "yaw": -0.45,
        "pitch": 0.35,
        "dist": 9.06
      },
      "prose": "",
      "boxSource": "auto",
      "camSource": "auto"
    },
    {
      "title": "Page 5",
      "page": 5,
      "box": [
        0.078,
        0.0515,
        0.912,
        0.7474
      ],
      "duration": 4,
      "cam": {
        "target": [
          0.0,
          2.0,
          0.0
        ],
        "yaw": -0.45,
        "pitch": 0.35,
        "dist": 9.06
      },
      "prose": "",
      "boxSource": "auto",
      "camSource": "auto"
    },
    {
      "title": "Page 6",
      "page": 6,
      "box": [
        0.2205,
        0.1608,
        0.467,
        0.333
      ],
      "duration": 4,
      "cam": {
        "target": [
          0.0,
          2.0,
          0.0
        ],
        "yaw": -0.45,
        "pitch": 0.35,
        "dist": 9.06
      },
      "prose": "",
      "boxSource": "auto",
      "camSource": "auto"
    },
    {
      "title": "Page 10",
      "page": 10,
      "box": [
        0.1005,
        0.1679,
        0.722,
        0.6116
      ],
      "duration": 4,
      "cam": {
        "target": [
          0.0,
          2.0,
          0.0
        ],
        "yaw": -0.45,
        "pitch": 0.35,
        "dist": 9.06
      },
      "prose": "",
      "boxSource": "auto",
      "camSource": "auto"
    },
    {
      "title": "Page 11",
      "page": 11,
      "box": [
        0.098,
        0.0656,
        0.9045,
        0.4265
      ],
      "duration": 4,
      "cam": {
        "target": [
          0.0,
          2.0,
          0.0
        ],
        "yaw": -0.45,
        "pitch": 0.35,
        "dist": 9.06
      },
      "prose": "",
      "boxSource": "auto",
      "camSource": "auto"
    },
    {
      "title": "Page 12",
      "page": 12,
      "box": [
        0.383,
        0.0656,
        0.7645,
        0.2325
      ],
      "duration": 4,
      "cam": {
        "target": [
          0.0,
          2.0,
          0.0
        ],
        "yaw": -0.45,
        "pitch": 0.35,
        "dist": 9.06
      },
      "prose": "",
      "boxSource": "auto",
      "camSource": "auto"
    },
    {
      "title": "Page 13",
      "page": 13,
      "box": [
        0.0705,
        0.048,
        0.912,
        0.9044
      ],
      "duration": 4,
      "cam": {
        "target": [
          0.0,
          2.0,
          0.0
        ],
        "yaw": -0.45,
        "pitch": 0.35,
        "dist": 9.06
      },
      "prose": "",
      "boxSource": "auto",
      "camSource": "auto"
    },
    {
      "title": "Page 14",
      "page": 14,
      "box": [
        0.098,
        0.0656,
        0.8295,
        0.8691
      ],
      "duration": 4,
      "cam": {
        "target": [
          0.0,
          2.0,
          0.0
        ],
        "yaw": -0.45,
        "pitch": 0.35,
        "dist": 9.06
      },
      "prose": "",
      "boxSource": "auto",
      "camSource": "auto"
    },
    {
      "title": "Page 15",
      "page": 15,
      "box": [
        0.0755,
        0.048,
        0.927,
        0.9168
      ],
      "duration": 4,
      "cam": {
        "target": [
          0.0,
          2.0,
          0.0
        ],
        "yaw": -0.45,
        "pitch": 0.35,
        "dist": 9.06
      },
      "prose": "",
      "boxSource": "auto",
      "camSource": "auto"
    },
    {
      "title": "Page 16",
      "page": 16,
      "box": [
        0.0755,
        0.048,
        0.927,
        0.9168
      ],
      "duration": 4,
      "cam": {
        "target": [
          0.0,
          2.0,
          0.0
        ],
        "yaw": -0.45,
        "pitch": 0.35,
        "dist": 9.06
      },
      "prose": "",
      "boxSource": "auto",
      "camSource": "auto"
    },
    {
      "title": "Page 7",
      "page": 7,
      "box": [
        0.0705,
        0.0497,
        0.922,
        0.9115
      ],
      "duration": 4,
      "cam": {
        "target": [
          0.0,
          2.0,
          0.0
        ],
        "yaw": -0.45,
        "pitch": 0.35,
        "dist": 9.06
      },
      "prose": "",
      "boxSource": "auto",
      "camSource": "auto"
    },
    {
      "title": "Page 8",
      "page": 8,
      "box": [
        0.073,
        0.0497,
        0.9245,
        0.9115
      ],
      "duration": 4,
      "cam": {
        "target": [
          0.0,
          2.0,
          0.0
        ],
        "yaw": -0.45,
        "pitch": 0.35,
        "dist": 9.06
      },
      "prose": "",
      "boxSource": "auto",
      "camSource": "auto"
    },
    {
      "title": "Page 9",
      "page": 9,
      "box": [
        0.0755,
        0.0497,
        0.927,
        0.9115
      ],
      "duration": 4,
      "cam": {
        "target": [
          0.0,
          2.0,
          0.0
        ],
        "yaw": -0.45,
        "pitch": 0.35,
        "dist": 9.06
      },
      "prose": "",
      "boxSource": "auto",
      "camSource": "auto"
    }
  ],
  "tags": [],
  "notes": ""
}